{
  "spec_version": "agentmanifest-0.3",
  "name": "Short Notes API",
  "version": "1.0.0",
  "description": "This manifest has agent_notes with exactly 149 characters, which is below the v0.3 minimum of 150. It should fail the agent_notes length check during validation.",
  "categories": ["other"],
  "primary_category": "reference",
  "endpoints": [
    {
      "path": "/test",
      "method": "GET",
      "description": "Test endpoint for validation purposes.",
      "parameters": [],
      "response_description": "Returns a simple response."
    }
  ],
  "authentication": {"required": false, "type": "none"},
  "pricing": {"model": "free", "free_tier": {"queries_per_day": 1000}, "paid_tier": null},
  "payment": null,
  "agent_notes": "Account: none. Authentication: api key. Pricing: free. This is 149 characters to fail v0.3 min. Account: none. Authentication: api key. Pricing: fre.",
  "contact": "test@example.com",
  "listing_requested": false,
  "last_updated": "2026-02-19T00:00:00Z"
}
